{
  "schema_version": "1.0",
  "oracle_version": "1.0-observed-1",
  "case_id": "pk-1a4f0a9ed56d",
  "packet_sha256": "8a9397ff51f5f4024daeadab87aeff60a3cf8969b949b7cde6fcf52e86ff42c6",
  "status": "unverified",
  "reasons": [
    "Actual drawing glyph/raster checks passed; hash-bound independent visual attestation remains required"
  ],
  "measurements": {
    "reader": "OCP.STEPControl_Reader",
    "units": [
      "millimetre"
    ],
    "solid_count": 1,
    "bbox_mm": [
      -34.0,
      -22.0,
      -19.5,
      34.0,
      22.0,
      19.5
    ],
    "envelope_mm": [
      68.0,
      44.0,
      39.0
    ],
    "volume_mm3": 115330.73144268425,
    "cylinders": [
      {
        "diameter_mm": 6.8,
        "center_xy_mm": [
          0.0,
          0.0
        ],
        "z_bounds_mm": [
          -7.7,
          15.5
        ]
      },
      {
        "diameter_mm": 12.8,
        "center_xy_mm": [
          0.0,
          0.0
        ],
        "z_bounds_mm": [
          15.5,
          19.5
        ]
      }
    ],
    "planes": [
      {
        "bbox_mm": [
          -34.0,
          -22.0,
          -19.5,
          -34.0,
          22.0,
          19.5
        ],
        "normal": [
          1.0,
          0.0,
          0.0
        ]
      },
      {
        "bbox_mm": [
          -34.0,
          -22.0,
          -19.5,
          34.0,
          -22.0,
          19.5
        ],
        "normal": [
          0.0,
          1.0,
          0.0
        ]
      },
      {
        "bbox_mm": [
          -34.0,
          -22.0,
          19.5,
          34.0,
          22.0,
          19.5
        ],
        "normal": [
          0.0,
          0.0,
          1.0
        ]
      },
      {
        "bbox_mm": [
          -34.0,
          22.0,
          -19.5,
          34.0,
          22.0,
          19.5
        ],
        "normal": [
          0.0,
          1.0,
          0.0
        ]
      },
      {
        "bbox_mm": [
          -34.0,
          -22.0,
          -19.5,
          34.0,
          22.0,
          -19.5
        ],
        "normal": [
          0.0,
          0.0,
          1.0
        ]
      },
      {
        "bbox_mm": [
          34.0,
          -22.0,
          -19.5,
          34.0,
          22.0,
          19.5
        ],
        "normal": [
          1.0,
          0.0,
          0.0
        ]
      },
      {
        "bbox_mm": [
          -6.4,
          -6.4,
          15.5,
          6.4,
          6.4,
          15.5
        ],
        "normal": [
          0.0,
          0.0,
          1.0
        ]
      },
      {
        "bbox_mm": [
          -3.4,
          -3.4,
          -7.7,
          3.4,
          3.4,
          -7.7
        ],
        "normal": [
          0.0,
          0.0,
          1.0
        ]
      }
    ],
    "length_tolerance_mm": 1e-06,
    "volume_tolerance_mm3": 0.0001,
    "bore_diameter_mm": 6.8,
    "bore_depth_mm": 27.2,
    "h1_count": 1,
    "counterbore_diameter_mm": 12.8,
    "counterbore_depth_mm": 4.0,
    "analytic_volume_mm3": 115330.7314426843,
    "volume_error_mm3": -4.3655745685100555e-11,
    "product_identity": "PT-001 REV A"
  },
  "drawing": {
    "parser": "pypdf.PdfReader",
    "renderer": "PDFium independent of shipped Poppler PNG",
    "render_dpi": 200,
    "page_size_pt": [
      842.0,
      595.0
    ],
    "text": "PART DRAWING\nSCHEMATIC VIEWS. NUMERIC ANNOTATIONS GOVERN; DO NOT MEASURE PIXELS.\nViews depict supplied STEP at model stage. Depths measured from top (+Z).\nDRAWING ID = PT-001\nDRAWING REV = A\nUNITS = in\nMATERIAL = 6061-T6\nMODEL STAGE = finished\nDRAWING STAGE = finished\nFINISH = none\nTOLERANCE STAGE = after_finish\nENVELOPE = 68.0000 x 44.0000 x 39.0000 in\nSURFACE ROUGHNESS = 3.20 um\nH1 DIAMETER = 6.8000 +/- 0.0500 in\nH1 COUNT = 1\nH1 TYPE = BLIND\nH1 DEPTH = 27.2000 in\nC1 DIAMETER = 12.8000 in\nC1 DEPTH = 4.0000 in\nPLAN (+Z)\nC1 / H1\nA\nA\nSECTION A-A (X-Z)\nC1\nH1 blind floor\nDeclared finite requirements and setup/profile are in packet.json.\n",
    "tokens": [
      {
        "text": "PART DRAWING",
        "origin_pt": [
          35.0,
          552.0
        ],
        "font_size_pt": 14.0
      },
      {
        "text": "SCHEMATIC VIEWS. NUMERIC ANNOTATIONS GOVERN; DO NOT MEASURE PIXELS.",
        "origin_pt": [
          35.0,
          534.0
        ],
        "font_size_pt": 9.0
      },
      {
        "text": "Views depict supplied STEP at model stage. Depths measured from top (+Z).",
        "origin_pt": [
          35.0,
          518.0
        ],
        "font_size_pt": 9.0
      },
      {
        "text": "DRAWING ID = PT-001",
        "origin_pt": [
          408.0,
          486.0
        ],
        "font_size_pt": 10.0,
        "box_pt": [
          408.7699890136719,
          485.8900146484375,
          511.4700012207031,
          493.2799987792969
        ],
        "crop": "label-03.png"
      },
      {
        "text": "DRAWING REV = A",
        "origin_pt": [
          408.0,
          470.0
        ],
        "font_size_pt": 10.0,
        "box_pt": [
          408.7699890136719,
          469.8900146484375,
          497.75,
          477.2799987792969
        ],
        "crop": "label-04.png"
      },
      {
        "text": "UNITS = in",
        "origin_pt": [
          408.0,
          454.0
        ],
        "font_size_pt": 10.0,
        "box_pt": [
          408.7900085449219,
          453.8900146484375,
          456.489990234375,
          461.2799987792969
        ],
        "crop": "label-05.png"
      },
      {
        "text": "MATERIAL = 6061-T6",
        "origin_pt": [
          408.0,
          438.0
        ],
        "font_size_pt": 10.0,
        "box_pt": [
          408.739990234375,
          437.8900146484375,
          506.19000244140625,
          445.19000244140625
        ],
        "crop": "label-06.png"
      },
      {
        "text": "MODEL STAGE = finished",
        "origin_pt": [
          408.0,
          422.0
        ],
        "font_size_pt": 10.0,
        "box_pt": [
          408.739990234375,
          421.8900146484375,
          525.3800048828125,
          429.2900085449219
        ],
        "crop": "label-07.png"
      },
      {
        "text": "DRAWING STAGE = finished",
        "origin_pt": [
          408.0,
          406.0
        ],
        "font_size_pt": 10.0,
        "box_pt": [
          408.7699890136719,
          405.8900146484375,
          538.1499633789062,
          413.2799987792969
        ],
        "crop": "label-08.png"
      },
      {
        "text": "FINISH = none",
        "origin_pt": [
          408.0,
          390.0
        ],
        "font_size_pt": 10.0,
        "box_pt": [
          408.82000732421875,
          389.8900146484375,
          474.010009765625,
          397.2799987792969
        ],
        "crop": "label-09.png"
      },
      {
        "text": "TOLERANCE STAGE = after_finish",
        "origin_pt": [
          408.0,
          374.0
        ],
        "font_size_pt": 10.0,
        "box_pt": [
          408.2300109863281,
          372.0199890136719,
          565.4299926757812,
          381.2900085449219
        ],
        "crop": "label-10.png"
      },
      {
        "text": "ENVELOPE = 68.0000 x 44.0000 x 39.0000 in",
        "origin_pt": [
          408.0,
          358.0
        ],
        "font_size_pt": 10.0,
        "box_pt": [
          408.7900085449219,
          357.8800048828125,
          612.719970703125,
          365.2900085449219
        ],
        "crop": "label-11.png"
      },
      {
        "text": "SURFACE ROUGHNESS = 3.20 um",
        "origin_pt": [
          408.0,
          342.0
        ],
        "font_size_pt": 10.0,
        "box_pt": [
          408.45001220703125,
          341.8800048828125,
          569.8999633789062,
          349.2900085449219
        ],
        "crop": "label-12.png"
      },
      {
        "text": "H1 DIAMETER = 6.8000 +/- 0.0500 in",
        "origin_pt": [
          408.0,
          326.0
        ],
        "font_size_pt": 10.0,
        "box_pt": [
          408.79998779296875,
          325.8900146484375,
          575.169921875,
          333.2799987792969
        ],
        "crop": "label-13.png"
      },
      {
        "text": "H1 COUNT = 1",
        "origin_pt": [
          408.0,
          310.0
        ],
        "font_size_pt": 10.0,
        "box_pt": [
          408.79998779296875,
          309.8900146484375,
          474.239990234375,
          317.2900085449219
        ],
        "crop": "label-14.png"
      },
      {
        "text": "H1 TYPE = BLIND",
        "origin_pt": [
          408.0,
          294.0
        ],
        "font_size_pt": 10.0,
        "box_pt": [
          408.79998779296875,
          294.0,
          490.0,
          301.19000244140625
        ],
        "crop": "label-15.png"
      },
      {
        "text": "H1 DEPTH = 27.2000 in",
        "origin_pt": [
          408.0,
          278.0
        ],
        "font_size_pt": 10.0,
        "box_pt": [
          408.79998779296875,
          277.8900146484375,
          514.8599853515625,
          285.19000244140625
        ],
        "crop": "label-16.png"
      },
      {
        "text": "C1 DIAMETER = 12.8000 in",
        "origin_pt": [
          408.0,
          262.0
        ],
        "font_size_pt": 10.0,
        "box_pt": [
          408.5,
          261.8900146484375,
          532.6399536132812,
          269.2799987792969
        ],
        "crop": "label-17.png"
      },